{
  "$defs": {
    "ActionClass": {
      "description": "ActiveGraph closed authority classes; reused, never re-invented.",
      "enum": [
        "R0",
        "R1",
        "R2",
        "R3",
        "R4"
      ],
      "title": "ActionClass",
      "type": "string"
    },
    "WorkflowStepV1": {
      "additionalProperties": false,
      "description": "One gauntlet CLI step inside a generated declarative workflow.\n\nSteps are expression-free by contract: the generated YAML uses only\nliteral arguments, because PowerFx expression evaluation requires a\ndotnet runtime and, more importantly, because the Python control plane\n(durable ``.gauntlet/`` state) is the single source of data flow.",
      "properties": {
        "action_class": {
          "$ref": "#/$defs/ActionClass",
          "default": "R0"
        },
        "command": {
          "items": {
            "minLength": 1,
            "type": "string"
          },
          "minItems": 1,
          "title": "Command",
          "type": "array"
        },
        "display_name": {
          "minLength": 1,
          "title": "Display Name",
          "type": "string"
        },
        "max_retries": {
          "default": 0,
          "maximum": 10,
          "minimum": 0,
          "title": "Max Retries",
          "type": "integer"
        },
        "on_gate_failure": {
          "default": "end",
          "enum": [
            "end",
            "continue"
          ],
          "title": "On Gate Failure",
          "type": "string"
        },
        "require_approval": {
          "default": false,
          "title": "Require Approval",
          "type": "boolean"
        },
        "retry_on_exit_codes": {
          "items": {
            "type": "integer"
          },
          "title": "Retry On Exit Codes",
          "type": "array"
        },
        "step_id": {
          "pattern": "^[a-z][a-z0-9_]*$",
          "title": "Step Id",
          "type": "string"
        },
        "timeout_seconds": {
          "default": 600,
          "minimum": 1,
          "title": "Timeout Seconds",
          "type": "integer"
        }
      },
      "required": [
        "step_id",
        "display_name",
        "command"
      ],
      "title": "WorkflowStepV1",
      "type": "object"
    }
  },
  "$id": "https://schemas.gauntlet.dev/workflow-plan.v1.schema.json",
  "$schema": "https://json-schema.org/draft/2020-12/schema",
  "additionalProperties": false,
  "description": "Typed source of truth for a generated .gauntlet/workflows/ YAML file.\n\nThe YAML is a derived artifact: its digest binds to this plan's digest,\nso hand edits are detected as drift instead of silently overwritten.\nSelf-healing repairs patch the plan (structured data), re-promote it,\nand regenerate the YAML.",
  "properties": {
    "checkpoint": {
      "default": true,
      "title": "Checkpoint",
      "type": "boolean"
    },
    "created_at": {
      "pattern": "^\\d{4}-\\d{2}-\\d{2}T\\d{2}:\\d{2}:\\d{2}(\\.\\d+)?Z$",
      "title": "Created At",
      "type": "string"
    },
    "description": {
      "minLength": 1,
      "title": "Description",
      "type": "string"
    },
    "generated_by": {
      "default": "gauntlet workflow generate",
      "minLength": 1,
      "title": "Generated By",
      "type": "string"
    },
    "inputs": {
      "additionalProperties": {
        "type": "string"
      },
      "title": "Inputs",
      "type": "object"
    },
    "parent_plan_digest": {
      "anyOf": [
        {
          "pattern": "^sha256:[0-9a-f]{64}$",
          "type": "string"
        },
        {
          "type": "null"
        }
      ],
      "default": null,
      "title": "Parent Plan Digest"
    },
    "plan_id": {
      "pattern": "^[a-z][a-z0-9-]*:[A-Za-z0-9._/-]+$",
      "title": "Plan Id",
      "type": "string"
    },
    "profile": {
      "default": "software",
      "minLength": 1,
      "title": "Profile",
      "type": "string"
    },
    "repairs_applied": {
      "items": {
        "pattern": "^[a-z][a-z0-9-]*:[A-Za-z0-9._/-]+$",
        "type": "string"
      },
      "title": "Repairs Applied",
      "type": "array"
    },
    "schema_version": {
      "const": "dev.gauntlet.workflow-plan/v1",
      "default": "dev.gauntlet.workflow-plan/v1",
      "title": "Schema Version",
      "type": "string"
    },
    "steps": {
      "items": {
        "$ref": "#/$defs/WorkflowStepV1"
      },
      "minItems": 1,
      "title": "Steps",
      "type": "array"
    },
    "workflow_name": {
      "pattern": "^[a-z][a-z0-9-]*$",
      "title": "Workflow Name",
      "type": "string"
    }
  },
  "required": [
    "plan_id",
    "workflow_name",
    "description",
    "steps",
    "created_at"
  ],
  "title": "WorkflowPlanV1",
  "type": "object"
}
